{"schema":"rll.route_forest_blueprint.v1","forest_id":"RLL-OMEGA-ROUTE-FOREST-20260731","generated_at":"2026-07-31T14:43:00Z","source_commit":"41b70ba9d33b1805720a924732e8e4f767859200","claim_allowed":false,"frequency_semantics":{"class":"[C]","window_id":"SNAPSHOT-20260731","window_kind":"structural_snapshot","unit":"events_per_snapshot","definition":"Count of declared, validated or gap-opening route events inside one versioned repository snapshot.","boundary":"Not physical frequency, not Hertz, not probability and not behavioral traffic."},"vector_semantics":{"class":"[C]","directions":["D1","D2","D3","D4","D5","D6","D7"],"score_scale":["absent","gap","partial","ready_for_test","verified"],"normalization":"component = score / 4","boundary":"Vectors are operational routing coordinates, not learned embeddings and not physical state vectors."},"regions":{"R1":{"direction":"D1","name":"origin_provenance","description":"Origins, lineage, immutable references and custody."},"R2":{"direction":"D2","name":"semantic_coherence","description":"Stable meanings, model families, epistemic states and aliases."},"R3":{"direction":"D3","name":"geometric_dimensional_integrity","description":"Units, domains, transformations, normalizations and vector geometry."},"R4":{"direction":"D4","name":"runtime_execution","description":"Executable workflows, deterministic gates, receipts and rollback."},"R5":{"direction":"D5","name":"temporal_state_memory","description":"Append-only history, precedence, invalidation and supersession."},"R6":{"direction":"D6","name":"rights_security","description":"License, privacy, authorization, authorship, retention and safety."},"R7":{"direction":"D7","name":"evidence_falsification","description":"Observables, baselines, uncertainty, controls, falsifiers and exit gates."}},"nodes":{"N-GOV-ROOT":{"tree":"T-GOVERNANCE","region":"R1","label":"Governance and audit root","kind":"root","status":"PARTIAL","scores":[3,3,2,4,2,2,2],"refs":["schemas/README.md"],"parent":null},"N-WORKFLOW-CONTRACT":{"tree":"T-GOVERNANCE","region":"R4","label":"Executable workflow contract","kind":"artifact","status":"VERIFIED","scores":[3,4,2,4,2,2,2],"refs":[".github/workflow-contract.yml","tools/validate_workflow_docs.py"],"parent":"N-GOV-ROOT"},"N-SCHEMA-REGISTRY":{"tree":"T-GOVERNANCE","region":"R2","label":"Claim-bounded schema registry","kind":"artifact","status":"VERIFIED","scores":[3,4,3,4,2,3,3],"refs":["schemas/README.md","tools/validate_schemas_claim_boundary.py"],"parent":"N-GOV-ROOT"},"N-OMEGA7":{"tree":"T-GOVERNANCE","region":"R3","label":"Omega7 operational assessment","kind":"artifact","status":"BLOCKED","scores":[2,3,1,4,2,2,1],"refs":["data/omega_operational/rll_omega7_operational.json","tools/validate_omega7_operational.py"],"parent":"N-GOV-ROOT"},"N-SCI-ROOT":{"tree":"T-SCIENCE","region":"R7","label":"Scientific route root","kind":"root","status":"PARTIAL","scores":[2,3,1,3,2,2,1],"refs":["docs/science/CANONICAL_ROUTE_CHECKLIST.md"],"parent":null},"N-DENSE-FEATURES":{"tree":"T-SCIENCE","region":"R3","label":"Dense behavior feature layer","kind":"artifact","status":"PARTIAL","scores":[2,3,3,3,2,2,2],"refs":["data/results/bootstrap/dense_behavior_features.json","docs/science/DENSE_BEHAVIOR_FEATURES_REPORT.md"],"parent":"N-SCI-ROOT"},"N-DIMENSIONAL-GAP":{"tree":"T-SCIENCE","region":"R3","label":"Full dimensional invariant registry","kind":"gap","status":"TOKEN_VAZIO","scores":[1,2,1,2,1,2,1],"refs":["data/omega_operational/rll_omega7_operational.json"],"parent":"N-DENSE-FEATURES"},"N-FALSIFIER-GAP":{"tree":"T-SCIENCE","region":"R7","label":"Growth holdout and CMB falsifier bundle","kind":"gap","status":"TOKEN_VAZIO","scores":[2,3,2,3,2,2,2],"refs":["data/epistemic_void/rll_epistemic_void.json","data/manifests/dados_reais_fundamentais_v1.json","docs/canonicos/METODOLOGIA_COERENTE_RLL.md"],"parent":"N-SCI-ROOT"},"N-LAT-ROOT":{"tree":"T-LATENTES","region":"R2","label":"RLL-LATENTES root","kind":"root","status":"PARTIAL","scores":[3,4,3,3,2,2,3],"refs":["src/rll/latentes.py"],"parent":null},"N-SEMANTIC-7D":{"tree":"T-LATENTES","region":"R2","label":"Seven-direction semantic unit","kind":"artifact","status":"READY_FOR_TEST","scores":[3,4,3,3,3,3,3],"refs":["docs/architecture/30_SEVEN_DIRECTION_SEMANTIC_MATRIX.md","schemas/semantic_token_unit.schema.json"],"parent":"N-LAT-ROOT"},"N-TOROIDAL-MAP":{"tree":"T-LATENTES","region":"R3","label":"Deterministic toroidal map","kind":"artifact","status":"PARTIAL","scores":[2,3,3,3,2,2,2],"refs":["src/rll/latentes.py"],"parent":"N-LAT-ROOT"},"N-NEGATIVE-CONTROLS":{"tree":"T-LATENTES","region":"R7","label":"Latent score and negative-control gate","kind":"control","status":"READY_FOR_TEST","scores":[2,3,2,3,2,2,4],"refs":["src/rll/latentes.py","data/results/negative_results_ledger.json"],"parent":"N-LAT-ROOT"},"N-ML-ROOT":{"tree":"T-ML-EVOLUTION","region":"R6","label":"Machine-learning evolution gate","kind":"root","status":"BLOCKED","scores":[2,3,2,2,2,1,2],"refs":["docs/architecture/31_OMEGA7_OPERATIONAL_INVARIANT.md"],"parent":null},"N-FEATURE-ENGINEERING":{"tree":"T-ML-EVOLUTION","region":"R3","label":"Feature engineering candidates","kind":"artifact","status":"PARTIAL","scores":[2,3,3,3,2,2,2],"refs":["data/results/bootstrap/dense_behavior_features.json","src/rll/latentes.py"],"parent":"N-ML-ROOT"},"N-DATA-RIGHTS-GAP":{"tree":"T-ML-EVOLUTION","region":"R6","label":"Dataset rights and license manifest","kind":"gap","status":"TOKEN_VAZIO","scores":[1,2,1,1,1,1,1],"refs":["data/omega_operational/rll_omega7_operational.json"],"parent":"N-FEATURE-ENGINEERING"},"N-HOLDOUT-GAP":{"tree":"T-ML-EVOLUTION","region":"R7","label":"Holdout leakage baseline and model-card package","kind":"gap","status":"TOKEN_VAZIO","scores":[1,2,1,1,1,2,1],"refs":["data/epistemic_void/rll_epistemic_void.json","docs/science/DENSE_BEHAVIOR_FEATURES_REPORT.md"],"parent":"N-FEATURE-ENGINEERING"},"N-TEMPORAL-MEMORY-GAP":{"tree":"T-SCIENCE","region":"R5","label":"Append-only state and precedence ledger","kind":"gap","status":"TOKEN_VAZIO","scores":[2,2,1,2,2,2,2],"refs":["data/omega_operational/rll_omega7_operational.json","data/manifests/dados_reais_fundamentais_v1.json","RLL_JSON_EVOLUTION_WATCHER.yml","artifacts/EVOLUTION_TRAIL.jsonl"],"parent":"N-SCI-ROOT"},"N-RD-ROOT":{"tree":"T-REAL-DATA","region":"R1","label":"Fundamental real observational data root","kind":"root","status":"VERIFIED","scores":[4,4,4,4,3,3,4],"refs":["data/manifests/dados_reais_fundamentais_v1.json","data/real/cosmology/real_cosmology_inputs.yml"],"parent":null},"N-RD-HZ":{"tree":"T-REAL-DATA","region":"R1","label":"H(z) cosmic chronometers, 33 points","kind":"dataset","status":"VERIFIED","scores":[4,4,4,4,3,3,4],"refs":["data/real/Hz_data_real.csv","data/failsafe/hz_cosmic_chronometers_FROZEN.json"],"parent":"N-RD-ROOT"},"N-RD-BAO":{"tree":"T-REAL-DATA","region":"R1","label":"BAO legacy BOSS and DESI route, 10 points","kind":"dataset","status":"VERIFIED","scores":[4,4,3,4,3,3,4],"refs":["data/real/BAO_data_real.csv","data/failsafe/bao_legacy_FROZEN.json"],"parent":"N-RD-ROOT"},"N-RD-DESI-DR2":{"tree":"T-REAL-DATA","region":"R3","label":"DESI DR2 BAO, 13 primary points with verified covariance summary","kind":"dataset","status":"VERIFIED","scores":[4,4,3,4,3,3,4],"refs":["data/real/cosmology/desi_dr2_bao_primary_points.csv","data/real/cosmology/desi_dr2_bao_covariance_summary.csv","data/failsafe/desi_dr2_bao_FROZEN.json"],"parent":"N-RD-BAO"},"N-RD-FSIGMA8":{"tree":"T-REAL-DATA","region":"R7","label":"f-sigma8 RSD growth compilation, 17 points","kind":"dataset","status":"VERIFIED","scores":[4,4,4,4,3,3,4],"refs":["data/real/cosmology/fsigma8_growth_real.csv","data/failsafe/fsigma8_growth_FROZEN.json"],"parent":"N-RD-ROOT"},"N-RD-CMB":{"tree":"T-REAL-DATA","region":"R7","label":"Planck 2018 compressed CMB shift block","kind":"dataset","status":"VERIFIED","scores":[4,4,4,4,3,3,4],"refs":["data/real/CMB_shift_real.json","data/failsafe/planck_2018_cmb_FROZEN.json"],"parent":"N-RD-ROOT"},"N-RD-PANTHEON":{"tree":"T-REAL-DATA","region":"R6","label":"Pantheon plus SH0ES release manifest; full covariance integration pending","kind":"dataset","status":"PARTIAL","scores":[4,3,2,2,2,2,2],"refs":["data/real/cosmology/pantheon_plus/MANIFEST.json","data/failsafe/pantheon_plus_shoes_FROZEN.json"],"parent":"N-RD-ROOT"},"N-METH-ROOT":{"tree":"T-METHODOLOGY","region":"R2","label":"Canonical coherent RLL methodology root","kind":"root","status":"VERIFIED","scores":[4,4,4,4,3,3,4],"refs":["docs/canonicos/METODOLOGIA_COERENTE_RLL.md"],"parent":null},"N-METH-INGEST":{"tree":"T-METHODOLOGY","region":"R1","label":"Ingestion and SHA-256 verification","kind":"artifact","status":"VERIFIED","scores":[4,4,4,4,3,3,4],"refs":["data/manifests/dados_reais_fundamentais_v1.json","RLL_JSON_EVOLUTION_WATCHER.yml"],"parent":"N-METH-ROOT"},"N-METH-LIKELIHOOD":{"tree":"T-METHODOLOGY","region":"R3","label":"Chi-square likelihood with explicit covariance policy","kind":"artifact","status":"VERIFIED","scores":[4,4,4,4,3,3,4],"refs":["rll_equation_registry.yml","data/pipelines/structure_d/joint_real_likelihood.py"],"parent":"N-METH-INGEST"},"N-METH-MODEL-SELECT":{"tree":"T-METHODOLOGY","region":"R7","label":"Model selection with AIC and BIC","kind":"artifact","status":"VERIFIED","scores":[4,4,4,4,3,3,4],"refs":["rll_equation_registry.yml","docs/canonicos/METODOLOGIA_COERENTE_RLL.md"],"parent":"N-METH-LIKELIHOOD"},"N-METH-CLAIM-GATE":{"tree":"T-METHODOLOGY","region":"R7","label":"Claim gating and falsification boundary","kind":"control","status":"VERIFIED","scores":[4,4,4,4,4,4,4],"refs":["tools/validate_schemas_claim_boundary.py","docs/canonicos/METODOLOGIA_COERENTE_RLL.md"],"parent":"N-METH-MODEL-SELECT"},"N-METH-PANTHEON-SNE":{"tree":"T-METHODOLOGY","region":"R4","label":"Pantheon plus full SNe likelihood integration","kind":"gap","status":"TOKEN_VAZIO","scores":[3,3,2,1,2,2,2],"refs":["data/manifests/dados_reais_fundamentais_v1.json","docs/science/PANTHEON_FULL_COVARIANCE_READINE